Job Title,Company Name,Location,Job Description,Salary Estimate,Job Type,Experience Level
Intern - Data Engineering,Not Specified,"Rolling Meadows, IL","Introduction Join our growing team of dedicated professionals at Gallagher Bassett, who guide those in need to the best possible outcomes for their health and wellbeing. You'll be part of a resilient team that works together to redefine the boundaries of excellence. At our organization, we value collaboration and making a positive impact in the lives of our clients and claimants, offering you the opportunity to join a team where your skills and dedication can truly make a difference. GUIDE. GUAR",Not Provided,Unknown,Unknown
IT Interns,Not Specified,United States,"You’ll gain valuable job experience while getting immersed in our collaborative, fun and engaging culture. We are seeking candidates for full-time summer employment as part of our paid internship program. The position reports into our Information Technology (IT) department and will be part of IT project initiatives positioned to meet Strategic Education’s business objectives. You will be part of a scrum team that is responsible for the design, development, testing, deployment, and support of mis",Not Provided,Full-time,Unknown
Intern - Seattle Operations,Not Specified,"Seattle, WA","This role is not eligible for 100% remote work. Employees must live within a commutable distance of the Seattle Metropolitan area and must be willing to be onsite at the Slalom Seattle office 5 days a week.** Title: Intern At Slalom, personal connection meets global scale. Our vision is to enable a world in which everyone loves their work and life. We help organizations of all kinds redefine what’s possible, give shape to the future—and get there. Are you ready to gain hands-on experience at a l",100,Intern,Unknown
Internship - Business Analyst,Not Specified,"Massachusetts, United States","About Job Summary Interacts with and conducts various duties and responsibilities for one or more functional teams in order to develop new skills and learn new areas of the business. Interns gain practical experience, relevant to their field of study, prior to college graduation. Essential Duties And Responsibilities To perform this job successfully, an individual must be able to perform the essential duties satisfactorily. Other minor duties may be assigned and may vary by location. Uses proble",Not Provided,Intern,Unknown
Internship - Business Analyst,Not Specified,"Illinois, United States","About Job Summary Interacts with and conducts various duties and responsibilities for one or more functional teams in order to develop new skills and learn new areas of the business. Interns gain practical experience, relevant to their field of study, prior to college graduation. Essential Duties And Responsibilities To perform this job successfully, an individual must be able to perform the essential duties satisfactorily. Other minor duties may be assigned and may vary by location. Uses proble",Not Provided,Intern,Unknown
"Product Designer, ChatGPT for Work",Not Specified,"New York, NY","About The Team OpenAI’s mission is to ensure that general-purpose artificial intelligence benefits all of humanity. The ChatGPT team works across research, engineering, product, and design to bring OpenAI’s technology to the world. We serve a diverse audience of users who are already using ChatGPT daily in their lives and work. We seek to learn from deployment and distribute the benefits of AI, while ensuring that this powerful tool is used responsibly and safely. Safety is more important to us ",Not Provided,Unknown,Unknown
Junior Entry Level Business Analyst,Not Specified,United States,"Dice is the leading career destination for tech experts at every stage of their careers. Our client, Ellianse LLC, is seeking the following. Apply via Dice today! Responsibilities: Basic understanding of various SDLC methodologies such as Waterfall and Agile.Proven ability to work effectively in a team environmentActive listening skillsFacilitation skillsBusiness writing skillsTechnical translationMuli-tasking skills Required Skills Bachelors degree.0-1 year of ExperienceExcellent communication ",0-1 ,Unknown,Lead
Entry-Level Risk Analyst,Not Specified,"Boston, MA","Job Description Key Responsibilities Monitor and analyze transactional activity to identify patterns or anomalies that indicate potential risk. Support the development and implementation of risk management policies and procedures. Collaborate with the Operations teams to resolve disputes and mitigate potential risks. Stay updated on industry trends, Sporting landscape and emerging risks and opportunities in ticketing and e-commerce. Provide support for compliance initiatives and audits as requir",Not Provided,Unknown,Unknown
Analytical Intern (Credit Ratings) - Early Careers,Not Specified,"Boulder, CO","About The Role Grade Level (for internal use): 05 Job Description About the Role: Join us at S&P Global Ratings, the world’s leading provider of credit ratings. The opportunity provides the chance to embark on a dynamic 10-week summer training and development journey that begins in June 2025. Our program offers unparalleled opportunities for growth, learning, and collaboration. The Team When you join S&P Global Ratings, you join one of the world's leading providers of independent credit risk res",05 ,Intern,Lead
Data Analyst,Not Specified,"San Francisco, CA","Job Description Calling all originals: At Levi Strauss & Co., you can be yourself — and be part of something bigger. We’re a company of people who like to forge our own path and leave the world better than we found it. Who believe that what makes us different makes us stronger. So add your voice. Make an impact. Find your fit — and your future. About The Job Conduct analysis on complex retail data, measure and track data created by data products, and convert them into key KPI metrics.Support bus",Not Provided,Unknown,Unknown
Analyst,Not Specified,"New York, NY","Location(s): 7 World Trade Center, 250 Greenwich Street, New York, New York, 10007, US Line Of Business: CSS(CSS) Job Category: Credit Analysis & Research Experience Level: Experienced Hire At Moody's, we unite the brightest minds to turn today’s risks into tomorrow’s opportunities. We do this by striving to create an inclusive environment where everyone feels welcome to be who they are-with the freedom to exchange ideas, think innovatively, and listen to each other and customers in meaningful w",7 ,Unknown,Unknown
Applied Mathematician,Not Specified,"Langley Forest, VA","Outlier helps the world’s most innovative companies improve their AI models by providing human feedback. Are you an experienced Mathematics expert who would like to lend your expertise to train AI models? About The Opportunity Outlier is looking for talented Mathematics expert to help train generative artificial intelligence models This freelance opportunity is remote and hours are flexible, so you can work whenever is best for you You may contribute your expertise by… Assessing the factuality a",Not Provided,Remote,Unknown
Strategy & Operations Intern,Not Specified,United States,"Duration: 6-Month Remote Internship, with a commitment of 2 hours daily Note: This is an unpaid internship position with the potential for future paid opportunities based on performance. Team meetings typically take place between 8 AM and 1 PM PST, and the intern will be expected to be available during these hours. Are you passionate about business strategy, decision-making, and client acquisition? Do you enjoy analyzing data, optimizing workflows, and overseeing teams to ensure projects succeed",6,Intern,Unknown
Junior Data Analyst,Not Specified,"Seattle, WA","Job Description LeadStack Inc. is an award winning, one of the nation's fastest growing, certified minority owned (MBE) staffing services provider of contingent workforce. As a recognized industry leader in contingent workforce solutions and Certified as a Great Place to Work, we're proud to partner with some of the most admired Fortune 500 brands in the world. Job Title: Junior Data Analyst Work location: Seattle, WA Fully onsite 5x per week Duration: 6 + Months Top Skills: SQL and Python and a",500 ,Unknown,Junior
Entry Level Consultant,Not Specified,"Austin, TX","📍 Location: Austin, TX 💰 Compensation: $37,000 - $70,000 (Year 1) | $100,000 - $250,000 (Year 2) 📈 Career Growth | Hands-On Training | Performance-Based PromotionsAbout Us:Front Page Agency Inc. is a rapidly expanding consulting firm specializing in industries such as insurance, nonprofit, and telecommunications. We are dedicated to creating a diverse and inclusive workplace where every team member receives the support needed to grow professionally. Our culture thrives on continuous learning, da","$37,000 ",Unknown,Unknown
Safety Data Analysis Intern,Not Specified,"Irvine, CA","At Kia, we are not just building award-winning cars; we’re shaping the future of mobility. With our bold designs, cutting-edge technology, and unwavering commitment to excellence, we’re redefining what it means to drive in the 21st century. As part of our team, you will be working alongside industry experts and visionary leaders who are driving change and making a difference every day. As an Intern, you will embark on a journey of discovery, learning, and growth. From day one, you will be immers",21,Intern,Lead
Wealth Management-New York-Associate-Quantitative Engineering,Not Specified,"New York, NY","Job Description Asset & Wealth Management - Associate Quantitative Strategist in Wealth Management Strats Our quantitative strategists are at the cutting edge of our business and solve real-world problems through a variety of analytical methods. As a member of our team, you will utilize your training in mathematics, programming, and logical thinking to build quantitative models that drive success in our business. Your problem-solving talents and aptitude for innovation will help define your cont",Not Provided,Unknown,Unknown
"Risk, Enterprise Risk, Analyst, Dallas",Not Specified,"Dallas, TX","Job Description The Risk division is responsible for credit, market and operational risk, model risk, independent liquidity risk, and insurance throughout the firm. The Enterprise Risk (ER) department manages a range of pan-Risk capabilities to ensure that Risk and divisional leadership have a comprehensive and aggregate view of the firm's risk profile to facilitate strategic planning and risk decision making. Within ER, the Stress Testing and Strategic Risk team is responsible for managing the ",Not Provided,Unknown,Lead
Global Banking & Markets Operations-New York-Analyst-Equity Derivatives Risk Middle Office,Not Specified,"New York, NY","Job Description OPERATIONS Operations is a dynamic, multi-faceted division that partners with all parts of the firm to provide banking, securities, and asset management services to clients around the world. In addition, Operations provides essential risk management and controls to preserve and enhance the firm's assets and its reputation. For every new product launched and every trade executed, it is Operations that develops and manages the processes and controls that enable business flow. YOUR ",Not Provided,Unknown,Unknown
Finance & Strategy Intern,Not Specified,"San Francisco, CA","About Stripe Stripe is a financial infrastructure platform for businesses. Millions of companies—from the world’s largest enterprises to the most ambitious startups—use Stripe to accept payments, grow their revenue, and accelerate new business opportunities. Our mission is to increase the GDP of the internet, and we have a staggering amount of work ahead. That means you have an unprecedented opportunity to put the global economy within everyone’s reach while doing the most important work of your",Not Provided,Intern,Unknown
Intern,Not Specified,"California, United States","Job Description Under general supervision of the sponsoring department management and CEO, the Intern will be responsible for completing non-complex projects assigned. Interns will submit an internship activities report to the sponsoring department management at the end of the internship which normally is an 8-10 week period. With approval from the functional area Vice-President and Human Resources an internship may be extended beyond the 10 week period provided the project is temporary, 6 month",8-10 ,Intern,Unknown
Summer 2025 Intern - Programs & Events Intern,Not Specified,"San Francisco, CA","To get the best candidate experience, please consider applying for a maximum of 3 roles within 12 months to ensure you are not duplicating efforts. About Futureforce University Recruiting Our Futureforce University Recruiting program is dedicated to attracting, retaining and cultivating talent. Our interns and new graduates work on real projects that affect how our business runs, giving them the opportunity to make a tangible impact on the future of our company. With offices all over the world, ",3 ,Intern,Unknown
Internship - Business Analyst,Not Specified,"Virginia, United States","About Job Summary Interacts with and conducts various duties and responsibilities for one or more functional teams in order to develop new skills and learn new areas of the business. Interns gain practical experience, relevant to their field of study, prior to college graduation. Essential Duties And Responsibilities To perform this job successfully, an individual must be able to perform the essential duties satisfactorily. Other minor duties may be assigned and may vary by location. Uses proble",Not Provided,Intern,Unknown
Energy Markets & Sustainability Analyst,Not Specified,"Boston, MA","Company Description About Veolia North America A subsidiary of Veolia group, Veolia North America (VNA) offers a full spectrum of water, waste and energy management services, including water and wastewater treatment, commercial and hazardous waste collection and disposal, energy consulting and resource recovery. VNA helps commercial, industrial, healthcare, higher education and municipality customers throughout North America. Headquartered in Boston, Mass., Veolia North America has more than 10,",10,Unknown,Unknown
Asset Management Intern,Not Specified,"New York, NY","Company Description Lightstone, founded by David Lichtenstein, is one of the most diversified privately held real estate companies in the United States. Headquartered in New York City, Lightstone is active in 26 states across the country, developing, managing and investing in all sectors of the real estate market, including residential, hospitality, commercial, and retail. With 182 existing properties, Lightstone’s over $7.5 billion portfolio currently includes over 15 million square feet of ind",26 ,Unknown,Unknown
Math Analyst,Not Specified,"Langley Forest, VA","Outlier helps the world’s most innovative companies improve their AI models by providing human feedback. Are you an experienced Mathematics expert who would like to lend your expertise to train AI models? About The Opportunity Outlier is looking for talented Mathematics expert to help train generative artificial intelligence models This freelance opportunity is remote and hours are flexible, so you can work whenever is best for you You may contribute your expertise by… Assessing the factuality a",Not Provided,Remote,Unknown
Intern,Not Specified,"New Haven, CT","Job Reference # 314507BR Job Type Part Time Your role Are you a motivated self-starter? Can you take an assignment and run with it? If you're ready to dive into a fast-paced, client-focused work environment, an internship may be the right fit for you. We welcome interns to become a part of our team. You will work with our experts and learn about the industry, our clients and our firm. This is an opportunity to gain valuable insight, develop new skills, and establish a network of mentors and busi",314507,Intern,Unknown
Data Analyst Summer Intern (Summer 2025),Not Specified,"Illinois, United States","Company Overview At Motorola Solutions, we believe that everything starts with our people. We’re a global close-knit community, united by the relentless pursuit to help keep people safer everywhere. Our critical communications, video security and command center technologies support public safety agencies and enterprises alike, enabling the coordination that’s critical for safer communities, safer schools, safer hospitals and safer businesses. Connect with a career that matters, and help us build",Not Provided,Unknown,Unknown
Fixed Income Algorithmic Trading - Credit,Not Specified,"New York, United States","Job Reference # 311824BR Job Type Full Time Your role We are seeking a credit systematic trader to join our fixed income algorithmic trading team within UBS Global Markets. This is a fast paced and collaborative team specialized in the development and management of best-in-class automated strategies in the fixed income space. The role will initially be focused on Corporate Bond Trading covering Algo, Portfolio Trading and ETF will apply data-driven and systematic approach to trading. will employ",311824,Unknown,Unknown
"Intern, Economic Valuation Services - Valuation | Philadelphia Winter 2026",Not Specified,"Philadelphia, PA","In this ever-changing market environment, our professionals must be adaptable and thrive in a collaborative, team-driven culture. At KPMG, our people are our number one priority. With a wealth of learning and career development opportunities, a world-class training facility and leading market tools, we make sure our people continue to grow both professionally and personally. If you are looking for a firm with a strong team connection where you can be your whole self, have an impact, advance your",Not Provided,Unknown,Lead
Data Analyst Intern,Not Specified,"New Jersey, United States","About For over 90 years, Topcon's vision has been to solve societal challenges around the globe. In healthcare, we are developing innovations that improve patients' health and quality of life. We empower eye care providers with advanced imaging, diagnostic solutions, and intelligent data technology. Our robotic devices deliver simplicity without compromise, by capturing clear images with the push of a button. By joining Topcon Healthcare, you become part of a growing, diverse, global team. With ",90 ,Unknown,Unknown
"Summer Intern, Product Management",Not Specified,"Ridgefield Park, NJ","Position Summary Headquartered in Ridgefield Park, N.J., Samsung Electronics America, Inc. (SEA) is a leader in mobile technologies, consumer electronics, home appliances and enterprise solutions. From our humble beginnings to our position today as a tech leader, our passion for innovation has been the common thread throughout our history. We’ve grown into one of THE most recognized global brands. We consider ourselves “relentless pioneers” that push boundaries and defy barriers. The company pus",Not Provided,Unknown,Lead
Junior Trader,Not Specified,"San Francisco, CA","The Junior Trader has general knowledge of equity trading strategies. This individual has a basic understanding of the managed accounts business, including wrap programs, wrap trading and general sponsor information. The primary responsibilities include trading new accounts, contributions and withdrawals, liquidations, restriction monitoring and tax selling. This person is also responsible for account-level maintenance such as modeling, trade allocation and general portfolio administration. Gene",Not Provided,Unknown,Junior
Geotechnical Engineering Intern- Summer 2025,Not Specified,"Irvine, CA","Job Description This Opportunity WSP USA hosts hundreds of internships across the United States to gain hands-on, meaningful work experience to enhance their education and professional aptitude. Our interns gain exposure to real projects while working side by side with senior staff. Through our Developing Professionals Network, interns gain mentorship, networking opportunities and lifelong career connections. Our Geotechnical & Tunnel Group is seeking an Engineering Intern to work out of our Irv",Not Provided,Intern,Senior
Data Analytics Intern,Not Specified,"Pleasanton, CA","Your work days are brighter here. At Workday, it all began with a conversation over breakfast. When our founders met at a sunny California diner, they came up with an idea to revolutionize the enterprise software market. And when we began to rise, one thing that really set us apart was our culture. A culture which was driven by our value of putting our people first. And ever since, the happiness, development, and contribution of every Workmate is central to who we are. Our Workmates believe a he",Not Provided,Unknown,Unknown
Market Research Intern – Gaming & Technology Insights,Not Specified,United States,Market Research Intern – Gaming & Technology Insights RoleWe’re looking for a part-time Intern to join our growing team and participate in exciting projects with a variety of clients! The weekly hour expectation should be less than 30 hours. This is a great opportunity to gain well-rounded experience with a leading consumer market research and consulting firm focused on the intersection of traditional and new media both domestically and internationally. This role is a 3-month internship that is ,30 ,Part-time,Lead
Business Analyst Intern- Summer Internship Program,Not Specified,United States,"Overview Business Analyst Intern- Summer Internship HealthEdge is dedicated to driving digital transformation in healthcare through transaction automation and real-time business and clinical engagement among healthcare payers, providers, and patients. We are excited to offer our summer internship program for the 7 th year! Internship Program : HealthEdge offers a paid 12-week virtual internship program that allows students to work on meaningful projects, learn about working in a SaaS company, an",7 ,Intern,Unknown
TikTok Shop - Product Operations Analyst,Not Specified,"Seattle, WA","Responsibilities About TikTok TikTok is the leading destination for short-form mobile video. At TikTok, our mission is to inspire creativity and bring joy. TikTok's global headquarters are in Los Angeles and Singapore, and its offices include New York, London, Dublin, Paris, Berlin, Dubai, Jakarta, Seoul, and Tokyo. Why Join Us Creation is the core of TikTok's purpose. Our platform is built to help imaginations thrive. This is doubly true of the teams that make TikTok possible. Together, we insp",Not Provided,Unknown,Lead
"Intern, Corporate Risk & Sustainability (Internship)",Not Specified,"Raleigh, NC","ERM is the world’s largest pure-play sustainability consultancy, employing more than 8,200 consultants in 150+ locations around the world. Our client base includes more than 50% of Fortune 500 companies. The Global Sustainability & Risk team within ERM comprises 70+ consultants at our corporate, or Group, level. We deliver technical, ESG and related business services internally. With the growth of our client-facing opportunities, we are looking to welcome two interns to our team. What is our vis",8,Intern,Unknown
Data Analyst,Not Specified,"New York, NY","About Us Camber builds software to improve the quality and accessibility of healthcare. We streamline and replace manual work so clinicians can focus on what they do best: providing great care. For more details on our thesis, check out our write-up: What is Camber? We’ve raised $50M in funding from phenomenal supporters at a16z, Craft Ventures, YCombinator, Manresa, and many others who are committed to improving the accessibility of care. For more information, take a look at: Announcing Camber -",$50,Unknown,Unknown
"Associate, Technology Innovation",Not Specified,"Boston, MA","Known for being a great place to work and build a career, KPMG provides audit, tax and advisory services for organizations in today's most important industries. Our growth is driven by delivering real results for our clients. It's also enabled by our culture, which encourages individual development, embraces an inclusive environment, rewards innovative excellence and supports our communities. With qualities like those, it's no wonder we're consistently ranked among the best companies to work for",Not Provided,Unknown,Unknown
Applied Mathematician - Canada,Not Specified,"Langley Forest, VA","Outlier helps the world’s most innovative companies improve their AI models by providing human feedback. Are you an experienced Mathematics expert who would like to lend your expertise to train AI models? About The Opportunity Outlier is looking for talented Mathematics expert to help train generative artificial intelligence models This freelance opportunity is remote and hours are flexible, so you can work whenever is best for you You may contribute your expertise by… Assessing the factuality a",Not Provided,Remote,Unknown
Data Analyst,Not Specified,United States,"About Delinea Delinea is a pioneer in securing identities through centralized authorization, making organizations more secure by seamlessly governing their interactions across the modern enterprise. Delinea allows organizations to apply context and intelligence throughout the identity lifecycle across cloud and traditional infrastructure, data, and SaaS applications to eliminate identity-related threats. With intelligent authorization, Delinea provides the only platform that enables you to disco",Not Provided,Unknown,Unknown
