Job Title,Company Name,Location,Job Description,Salary Estimate,Job Type,Experience Level
Product Manager/Strategy,Not Specified,United States,"Job Description The Company: With a presence in over 175 countries, we are one of the biggest technology companies in the world. We're using innovative new technologies to tackle real-world problems today. From advancing energy efficiency to reimagining online commerce, the work we do is not only redefining the world of business—it's helping advance governments, power nonprofits, and giving billions of people the tools they need to outpace change. For more information about Oracle (NYSE:ORCL), v",175 ,Unknown,Unknown
Associate Product Manager,Not Specified,"San Francisco, CA","$100,000 - $175,000 Full-time / Onsite About The Role As an Associate Product Manager, you’ll be instrumental in shaping and executing our product strategy, driving innovation, and building products that transform the healthcare industry. Working closely with cross-functional teams, including engineering, design, marketing, and operations, you’ll deliver outstanding products that meet our customers' needs and improve patient outcomes. The Associate Product Manager will also collaborate closely w","$100,000 ",Full-time,Manager
"Product Manager II, YouTube Discovery",Not Specified,"San Bruno, CA","Minimum qualifications: Bachelor's degree or equivalent practical experience.5 years of experience with product management.Experience in consumer Machine Learning (ML) product launches.Experience directing product improvements within machine learning, AI or recommendations products.Experience with experiment design (e.g., counterfactuals, holdbacks, interpretation, etc.). Preferred qualifications: Experience with Generative AI program management (e.g., model quality, costing, responsibility, per",5 ,Unknown,Unknown
"Product Manager - Aladdin Product Management, Associate",Not Specified,"New York, NY","About This Role BlackRock is the world’s leading asset management firm and Aladdin is the central nervous system for investment professionals to see their whole portfolio, understand risk exposure, and act with precision. It is a $1BN+ technology business that has significant growth aspirations over the next five years. Being a part of BlackRock means being a part of a community of smart, results-oriented people who are pursuing some of the world’s most sophisticated financial challenges. And ou",$1,Unknown,Lead
"Technical Product Manager, Autonomy & Robotics",Not Specified,"San Francisco, CA","About The Team DoorDash Labs is an independent team within DoorDash. We explore robotics and automation to transform last mile logistics in the long term. If you want to work on commercializing autonomy and robotics in a service used by millions of people, then we want to talk to you! About The Role Come help us redefine last-mile logistics through robotics, automation, and other advanced technologies! DoorDash Labs is an independent team inside of DoorDash incubating long-term bets and explorin",Not Provided,Unknown,Unknown
"Product Manager, Media Production Algorithms",Not Specified,"Los Angeles, CA","Netflix is one of the world's leading entertainment services, with 283 million paid memberships in over 190 countries enjoying TV series, films and games across a wide variety of genres and languages. Members can play, pause and resume watching as much as they want, anytime, anywhere, and can change their plans at any time. The Content and Business Products team builds a suite of tools and products to scale the operations behind taking a Netflix show from concept to streaming. This role will ups",283 ,Unknown,Lead
Data Analyst - TC - Data and Analy-Data Product Mgmt - FSO - Manager - Multiple Positions-1579642,Not Specified,"Hoboken, NJ","EY focuses on high-ethical standards and integrity among its employees and expects all candidates to demonstrate these qualities. At EY, you’ll have the chance to build a career as unique as you are, with the global scale, support, inclusive culture and technology to become the best version of you. And we’re counting on your unique voice and perspective to help EY become even better, too. Join us and build an exceptional experience for yourself, and a better working world for all. Data Analyst, ",Not Provided,Unknown,Unknown
Lead Product Manager,Not Specified,United States,"SeatGeek believes live events are powerful experiences that unite humans. With our technological savvy and fan-first attitude we’re simplifying and modernizing the ticketing industry. By catering to both fans and rightsholders, we’re powering a new, open entertainment ecosystem where fans have effortless access to experiences, and teams, venues, and shows have seamless access to their audiences. Because everyone should expect more from ticketing. We are looking for an experienced Product Manager",Not Provided,Unknown,Manager
"Lead Product Manager, Economy - Monopoly GO!",Not Specified,"Los Angeles, CA","Description Scopely is looking for a Lead Product Manager, Game Economy to join our Monopoly GO! game team remotely within the US or Canada. At Scopely, we care deeply about what we do and want to inspire play, every day - whether in our work environments alongside our talented colleagues, or through our deep connections with our communities of players. We are a global team of game lovers who are developing, publishing and innovating the mobile games industry, connecting millions of people aroun",Not Provided,Remote,Lead
"Product Manager, Vertex, Google Cloud",Not Specified,"Sunnyvale, CA",Minimum qualifications: Bachelor's degree or equivalent practical experience.5 years of experience in product management or related technical role.2 years of experience taking technical products from conception to launch.Experience with the domain area of Generative AI or Large Language Models. Preferred qualifications: Experience building AI/ML platform products for cloud customers.Experience shipping enterprise products to a developer or data science audience.Experience with generative AI mode,5 ,Unknown,Unknown
Product Manager/Strategy 4-ProdDev,Not Specified,United States,"Job Description Lead a team that acts as the central resource and driving force for the design, process, manufacturing, test, quality and marketing of product(s) as they move from conception to distribution. Organize interdepartmental activities ensuring completion of the project/product on schedule and within budget. Career Level - IC4 Responsibilities As a member of the product development division, you will analyze and integrate external customer specifications. Suggest and justify product di",4 ,Unknown,Lead
"Product Manager II, Compute Economics Data Platform, Google Cloud",Not Specified,"Sunnyvale, CA","Minimum qualifications: Bachelor's degree or equivalent practical experience.5 years of experience in product management or related technical role.2 years of experience developing or launching infrastructure products or technologies within networking, storage, compute hardware, databases, file systems, data analytics, cluster management, and other software infrastructure areas. Preferred qualifications: Master's degree in a technology or business related field.3 years of experience in a role pre",5 ,Unknown,Unknown
Technical Product Marketing Manager/Sr Technical Product Marketing Manager,Not Specified,"San Francisco, CA","To get the best candidate experience, please consider applying for a maximum of 3 roles within 12 months to ensure you are not duplicating efforts. Job Category Marketing & Communications Job Details About Salesforce We’re Salesforce, the Customer Company, inspiring the future of business with AI+ Data +CRM. Leading with our core values, we help companies across every industry blaze new trails and connect with customers in a whole new way. And, we empower you to be a Trailblazer, too — driving y",3 ,Unknown,Lead
Associate Product Manager,Not Specified,"Kirkland, WA","$100,000 - $175,000 Full-time / Onsite About The Role As an Associate Product Manager, you’ll be instrumental in shaping and executing our product strategy, driving innovation, and building products that transform the healthcare industry. Working closely with cross-functional teams, including engineering, design, marketing, and operations, you’ll deliver outstanding products that meet our customers' needs and improve patient outcomes. The Associate Product Manager will also collaborate closely w","$100,000 ",Full-time,Manager
"Product Manager, API",Not Specified,"New York, NY","About Anthropic Anthropic’s mission is to create reliable, interpretable, and steerable AI systems. We want AI to be safe and beneficial for our users and for society as a whole. Our team is a quickly growing group of committed researchers, engineers, policy experts, and business leaders working together to build beneficial AI systems. About The Role As a Product Manager on the Platform team, you will partner with engineers and researchers to build an excellent, user-friendly, and scalable API f",Not Provided,Unknown,Lead
Product Manager Intern,Not Specified,"Bellevue, WA","Job Description Summary As part of the Science and Technology Organization (STO), we develop the services that drive the next generation of healthcare applications and enable developers to build new and innovative solutions to address both clinical and operational needs. The CareIntellect Oncology team helps hospitals and health systems care for cancer patients more efficiently, effectively, and with higher quality. We coordinate scattered healthcare data, complex protocols, and adherence to car",Not Provided,Unknown,Unknown
"Product Manager, Prototyping",Not Specified,"New York, NY","Figma is growing our team of passionate people on a mission to make design accessible to all. Born on the Web, Figma helps entire product teams brainstorm, design and build better products — from start to finish. Whether it’s consolidating tools, simplifying workflows, or collaborating across teams and time zones, Figma makes the design process faster, more efficient, and fun while keeping everyone on the same page. From great products to long-lasting companies, we believe that nothing great is ",Not Provided,Unknown,Unknown
Product Manager Player Experience,Not Specified,United States,"Inclusively is partnering with a voice, video, and text communication service company to hire a Product Manager Player Experience. **Please note: this role is NOT an internal position with Inclusively but with the partner company.** ABOUT INCLUSIVELY:Inclusively is a digital tech platform that empowers job seekers with disabilities, caregivers, and veterans by using Success Enablers–accommodations and personalized workplace modifications that help all job seekers reach their full potential and e",Not Provided,Intern,Manager
Product Manager,Not Specified,United States,"About The RoleA dynamic team is seeking a Product Manager to enhance its user-driven approach. This role offers the chance to significantly impact by leading user interviews, gathering requirements, and ensuring top-notch features are developed and delivered—features that assist software engineers across the globe! Additionally, this position provides a fantastic opportunity to lay the groundwork for a more delightful user experience. As part of a small, agile startup, the team aims to respond q",Not Provided,Unknown,Lead
"Product Manager, Warehouse Tools",Not Specified,"King of Prussia, PA","At eBay, we're more than a global ecommerce leader — we’re changing the way the world shops and sells. Our platform empowers millions of buyers and sellers in more than 190 markets around the world. We’re committed to pushing boundaries and leaving our mark as we reinvent the future of ecommerce for enthusiasts. Our customers are our compass, authenticity thrives, bold ideas are welcome, and everyone can bring their unique selves to work — every day. We're in this together, sustaining the future",190 ,Unknown,Lead
Product Manager-C13-New Jersey-Hybrid,Not Specified,"Jersey City, NJ",The Technology Product Management Lead Analyst is a strategic professional who stays abreast of developments within own field and contributes to directional strategy by considering their application in own job and the business. Recognized technical authority for an area within the business. Requires basic commercial awareness. There are typically multiple people within the business that provide the same level of subject matter expertise. Developed communication and diplomacy skills are required ,Not Provided,Unknown,Lead
"Senior Product Manager, Search Algorithms",Not Specified,"San Francisco, CA","About Faire Faire is an online wholesale marketplace built on the belief that the future is local — independent retailers around the globe are doing more revenue than Walmart and Amazon combined, but individually, they are small compared to these massive entities. At Faire, we're using the power of tech, data, and machine learning to connect this thriving community of entrepreneurs across the globe. Picture your favorite boutique in town — we help them discover the best products from around the ",Not Provided,Unknown,Unknown
"Product Support Manager, Google Photos and Google One",Not Specified,"Boulder, CO","The application window will be open until at least February 12, 2025. This opportunity will remain online based on business needs which may be before or after the specified date. Note: By applying to this position you will have an opportunity to share your preferred working location from the following: Boulder, CO, USA; Atlanta, GA, USA.Minimum qualifications: Bachelor’s degree or equivalent practical experience.5 years of experience in a technical project management or a customer-facing role. P",12,Unknown,Unknown
"Product Manager, Core Product (Claude.ai)",Not Specified,"San Francisco, CA","About Anthropic Anthropic’s mission is to create reliable, interpretable, and steerable AI systems. We want AI to be safe and beneficial for our users and for society as a whole. Our team is a quickly growing group of committed researchers, engineers, policy experts, and business leaders working together to build beneficial AI systems. About The Role As the Product Manager for Core Product at Claude.ai, you will shape the evolution of Claude from an AI assistant to a true collaborative partner f",Not Provided,Unknown,Lead
Staff Product Manager,Not Specified,"Mountain View, CA",Overview We are seeking an exceptional Staff Product Manager who thrives on reimagining flagship platforms at scale and leading across a large organization. This Staff Product Manager will lead the product team focused on “QuickBooks Ecosystem Platform Transformation End to End”. This team brings together the end to end experience across all the changes in the platform and brings them to market starting with experiments and following with big launches across all target audiences and geographies.,Not Provided,Unknown,Lead
Product Manager Intern (TikTok Shop - Product - Creator Affiliate and Agency) - 2025 Summer Start (MBA),Not Specified,"Seattle, WA","Responsibilities TikTok is the leading destination for short-form mobile video. At TikTok, our mission is to inspire creativity and bring joy. TikTok's global headquarters are in Los Angeles and Singapore, and its offices include New York, London, Dublin, Paris, Berlin, Dubai, Jakarta, Seoul, and Tokyo. Why Join Us Creation is the core of TikTok's purpose. Our platform is built to help imaginations thrive. This is doubly true of the teams that make TikTok possible. Together, we inspire creativit",Not Provided,Unknown,Lead
Product Manager - Infrastructure,Not Specified,"San Francisco, CA","About Anyscale:At Anyscale, we're on a mission to democratize distributed computing and make it accessible to software developers of all skill levels. We’re commercializing Ray, a popular open-source project that's creating an ecosystem of libraries for scalable machine learning. Companies like OpenAI, Uber, Spotify, Instacart, Cruise, and many more, have Ray in their tech stacks to accelerate the progress of AI applications out into the real world.With Anyscale, we’re building the best place to",Not Provided,Unknown,Unknown
Associate Product Manager,Not Specified,"Carlsbad, CA","Why Orthofix? Guided by our organizational values – Take Ownership | Innovate Boldly | Win Together – we collaborate closely with world-class surgeons and other partners to improve people’s quality of life. At Orthofix, we want team members who build relationships and share knowledge, challenge the status quo, and deliver results every day to help us achieve our vision to be the unrivaled partner in Med Tech. Our global team of over 1,600 employees brings to market highly innovative, cost-effect",1,Unknown,Unknown
AI/ML Product Manager,Not Specified,"Upper Providence Township, PA","hackajob has partnered with one of the world's largest research-based pharmaceutical companies that that discovers, develops, manufactures and markets human health. Role: AI/ML Product ManagerLocation/s: San Francisco, CA or Upper Providence Township, PA (Hybrid, 2-3 days per week)Employment type: Fulltime Basic Qualifications:4+ years of experience with bioinformatics/genomics databases, biological datasets, biotech or Pharma R&D.2+ years of experience with cloud-based AI model development serv",2-3 ,Hybrid,Manager
Machine Learning & AI Development Intern,Not Specified,"Minnesota, United States","About ABOUT INSPIRE MEDICAL SYSTEMS Inspire is the first of its kind medical device designed to make a difference in the lives of those living with Obstructive Sleep Apnea (OSA). We are revolutionizing the sleep industry with our FDA-approved medical device, designed to reduce OSA severity for those who cannot tolerate or get consistent benefit from CPAP. Inspire Medical Systems is committed to enhancing patients' lives through sleep innovation. We are steadfast in our commitment to prioritize p",Not Provided,Unknown,Unknown
2025 Cell Line Development R&D Intern - Computational Biology & Machine Learning Applications,Not Specified,"South San Francisco, CA","Company Description AbbVie's mission is to discover and deliver innovative medicines and solutions that solve serious health issues today and address the medical challenges of tomorrow. We strive to have a remarkable impact on people's lives across several key therapeutic areas immunology, oncology, neuroscience, and eye care and products and services in our Allergan Aesthetics portfolio. For more information about AbbVie, please visit us atwww.abbvie.com. Follow @abbvie onTwitter,Facebook,Insta",Not Provided,Unknown,Unknown
Cybersecurity Analyst II - ISSO,Not Specified,"Edwards, CA","JT4, LLC provides engineering and technical support to multiple western test ranges for the U.S. Air Force, Space Force, and Navy under the Joint Range Technical Services Contract, better known as J-Tech II. JT4 develops and maintains realistic, integrated test and training environments and prepares our nation's war-fighting aircraft, weapons systems, and aircrews for today's missions and tomorrow's global challenges. What You Will Do With JT4 The Cybersecurity Analyst II will monitor, develop, ",4,Contract,Unknown
Cybersecurity Analyst,Not Specified,"Setauket, NY","Job Description Stafford Associates is currently seeking to fill a full-time position for a confident, detail-oriented person with a professional attitude. The ideal applicant would be someone who is a self-starter, organized, and can handle multiple tasks and ongoing projects as needed. This is a full-time position on our internal IT Security team, to implement, support, and maintain the security infrastructure for our clients and our hosting environment. This is an in-person position at our Se",Not Provided,Full-time,Unknown
Cybersecurity Analyst (Mid),Not Specified,"Rockville, MD","Job Title:Cybersecurity Analyst (Mid) Location: NCR or Clarksburg Job Category: Information Technology Time Type: Full-time Clearance Requirement: Current TS/SCI Clearance required Security Suitability: Must pass FBI security suitability Polygraph Requirement: Must pass an FBI administered Counterintelligence polygraph if one has not been conducted within the last five years. Employee Type: W2 or 1099 Citizenship: US Citizen, no Dual Citizenship Summary: NexThreat is seeking Cybersecurity Analys",2 ,Full-time,Mid
Senior Cybersecurity Analyst,Not Specified,"Edwards, CA","Spectrum is seeking a talented Senior Cyber Analyst to provide support for our customer located at Edwards AFB, CA. In this role you will advise and assist our customers with cybersecurity test planning, execution, and reporting within an operational test environment. Key Roles and Responsibilities Duties Apply your Cybersecurity analytical ability to support our customer’s various operational cyber test programs with the following typical duties to: Advise on integrated, dynamic Cyber defense a",Not Provided,Unknown,Senior
Cybersecurity Analyst,Not Specified,"Palo Alto, CA","Job: Cybersecurity Analyst Duration: 3 Month Location: 607 Hansen Way,Palo Alto California 94304 Role SummaryTechnical SkillsMust have:Experience in creating and launching security awareness training programs in a virtual environmentCybersecurity fundamentals with a strong understanding of reducing riskFamiliarity with cybersecurity principles, threats, best practices, and regulatory frameworks (e.g., NIST CSF, ISO 27001, GDPR, HIPAA)Nice to Have:Understanding of network securityFamiliarity with",3 ,Unknown,Unknown
Classified Cybersecurity Analyst - Polygraph - R10186212,Not Specified,"Redondo Beach, CA","Requisition ID: R10186212 Category: Information TechnologyLocation: Redondo Beach, California, United States of America | Linthicum, Maryland, United States of AmericaClearance Type: PolygraphTelecommute: No- Teleworking not available for this positionShift: 1st Shift (United States of America)Travel Required: Yes, 10% of the TimeRelocation Assistance: Relocation assistance may be availablePositions Available: 1 At Northrop Grumman, our employees have incredible opportunities to work on revoluti",10186212 ,Unknown,Unknown
Cybersecurity Analyst,Not Specified,"Fort Meade, MD","Description This position will support the DISA GSM-O II Task Number 07 (TN07) Joint Force Headquarters DODIN. GSM-O II provides network operations and cyber defense support to the Defense Information Systems Agency (DISA) in support of the DoD and COCOMs. The selected candidate shall, in accordance with mission requirements, provide holistic enterprise defensive strategies for enterprise cyber security capabilities implemented within the infrastructure of the DODIN to include but not limited to",07 ,Unknown,Unknown
Cybersecurity Analyst V,Not Specified,"Rockville, MD","Dice is the leading career destination for tech experts at every stage of their careers. Our client, Fynbosys Inc, is seeking the following. Apply via Dice today! Job Description This role is responsible for safeguarding the organization's digital assets by monitoring, responding to, and investigating suspected cyber threats and malicious activities across multiple environments. This role involves triage and data collection to support effective threat response and remediation. The analyst also c",Not Provided,Unknown,Lead
"University, Cybersecurity Analyst Intern",Not Specified,"McLean, VA","Job Number: R0216019 University, Cybersecurity Analyst Intern The Opportunity: As a cyber mission specialist, you understand the value of hunt-forward operations, and you know that battles are won in the grey. At Booz Allen, you can use your cyberspace operations experience to create solutions that will be executed on a worldwide stage. We’re looking for a cyber mission specialist like you to apply your skills in monitoring tools and impact our nation’s defense. In this role, you’ll be counted o",0216019 ,Intern,Unknown
"University, Cybersecurity Analyst Intern",Not Specified,"Raleigh, NC","Job Number: R0216019 University, Cybersecurity Analyst Intern The Opportunity: As a cyber mission specialist, you understand the value of hunt-forward operations, and you know that battles are won in the grey. At Booz Allen, you can use your cyberspace operations experience to create solutions that will be executed on a worldwide stage. We’re looking for a cyber mission specialist like you to apply your skills in monitoring tools and impact our nation’s defense. In this role, you’ll be counted o",0216019 ,Intern,Unknown
Cybersecurity Analyst,Not Specified,"New York, NY","Job Description PERMANENT FULL TIME JOB JOB IN NYC ON SITE JOB GREEN CARD OR US CITIZEN BANKING EXPERIENCE A MUST VERY URGENT JOB COMPTIA SECURITY+ CERTIFICATE Job Description Seeking a detail-oriented and motivated Information Security Analyst to join our team. In this role, you will assist in planning, implementing, upgrading, and monitoring security measures to protect computer networks and sensitive information. You will play a critical role in ensuring appropriate security controls are in p",Not Provided,Unknown,Unknown
"Strategic Student Program: Cybersecurity Analyst Intern (Summer 2025, FTO)",Not Specified,"Charlotte, NC","Siemens Industry Software Inc. Strategic Student Program (SSP) We are a leading global software company dedicated to the world of computer aided design, 3D modeling and simulation— helping innovative global manufacturers design better products, faster! With the resources of a large company, and the energy of a software start-up, we have fun together while creating a world class software portfolio. Our culture encourages creativity, welcomes fresh thinking and focuses on growth, so our people, ou",3,Unknown,Lead
